{"meta":{"caseId":"DEMO-ECLI-2018-3444","caseTitle":"Historische bunkeroliezaak — geanonimiseerd","analyst":"Demonstratie","asOfDate":"2020-04-07"},"fields":{"bdnNumber":"Geanonimiseerd","originalBatchId":"DEMO-PARTIJ-2011","currentBatchId":"DEMO-DEBUNKER-2011","fuelGrade":"MG380 / IFO RMG 380 LS 1%","deliveryDate":"2011-08-10","firstComplaintDate":"2011-08-13","vessel":"Geanonimiseerd zeeschip","originalSupplier":"Geanonimiseerd","origin":"Openbare uitspraak","reason":"operational","technicalImpact":"safety","multipleComplaints":"unknown","priceDrop":"66.8","incidentDescription":"Herhaalde filter- en separatorproblemen; vrees voor schade of stilvallen.","isoStatus":"partial","contamination":"unknown","tankSample":"unknown","compositeSample":"unknown","analysisCoversComplaint":"partial","sealConsistency":"unknown","qualityFindings":"BDN 0,02% sediment; later rapport 0,08%; latere test omvatte sediment niet.","transferDate":"2011-10-18","plannedMass":"85","receivedMass":"","measurementMethod":"documents","receiver":"Geanonimiseerde oliehandelaar","receivingAsset":"Geanonimiseerd motortankschip","receiverAuthority":"none","crossBorder":"yes","destination":"België (voorgenomen)","receiptConfirmed":"unknown","destinationChanged":"unknown","declaredStatus":"waste","statusDecider":"Gerechtshof Den Haag, achteraf","directReuse":"no","treatmentNeeded":"substantial","treatmentAuthorised":"unknown","resupply":"yes-before-treatment","statusRationale":"Het hof kwalificeerde de partij bij inzameling als gevaarlijke afvalstof."},"lineage":[{"childId":"DEMO-DEBUNKER-2011","action":"Transfer","date":"2011-10-18","mass":"85"}],"sources":[{"reference":"https://uitspraken.rechtspraak.nl/details?id=ECLI:NL:GHDHA:2018:3444","date":"2018-12-12","rating":"A1"},{"reference":"https://uitspraken.rechtspraak.nl/details?id=ECLI:NL:HR:2020:435","date":"2020-04-07","rating":"A1"}]}
